{
    "$schema": "http://json-schema.org/draft-07/schema",
    "$id": "https://raw.githubusercontent.com/Outsmart-OOH/ooh_open_direct/master/schema/v1/resources/stats/stats_object.json",
    "type": "object",
    "title": "Stats object",
    "description": "Object that describes the request for Reporting Stats",
    "default": {},
    "additionalProperties": false,
    "properties": {
        "$schema": {
            "type": "string",
            "format": "uri",
            "description": "$schema only included to aid validation of JSON, should not be used in real calls."
        },
        "AccountId": {
            "$id": "#/properties/",
            "type": "string",
            "title": "AccountId",
            "description": "The Account the Stats are for"
        },
        "OrderId": {
            "$id": "#/properties/",
            "type": "string",
            "title": "AccountId",
            "description": "The Order the Stats are for"
        },
        "LineId": {
            "$id": "#/properties/",
            "type": "string",
            "title": "AccountId",
            "description": "The Order the Stats are for"
        },
        "ReportStartDate": {
            "$id": "#/properties/",
            "type": "string",
            "format": "date",
            "title": "Start Date",
            "description": "The date report will start. if left blank, it will revert to the LineID start date"
        },
        "ReportEndDate": {
            "$id": "#/properties/",
            "type": "string",
            "format": "date",
            "title": "Start Date",
            "description": "The date report will end. if left blank, it will revert to the LineID end date"
        },
        "ReportFields": {
            "$id": "#/properties/",
            "description": "The fields that are to be included in the Stats report",
            "type": "array",
            "items": {
                "type": "string",
                "enum": [
                    "StartDate",
                    "EndDate",
                    "SpotLength",
                    "ShareOfTime",
                    "FrameID",
                    "CreativeID",
                    "BookedPlays",
                    "DeliveredPlays",
                    "Delivery"
                ]
            },
            "readOnly": true
        },
        "ReportGranularity": {
            "$id": "#/properties/",
            "description": "The time granularity of the Stats report",
            "type": "string",
            "enum": [
                "Flight",
                "Week",
                "Day",
                "Hour",
                "Spot"
            ],
            "maxLength": 15,
            "readOnly": true
        },
        "ReportFormat": {
            "$id": "#/properties/",
            "description": "The time granularity of the Stats report",
            "type": "string",
            "enum": [
                "Verbose",
                "NonVerbose"
            ],
            "maxLength": 15,
            "readOnly": true
        },
        "Webhook": {
            "$id": "#/properties/",
            "type": "string",
            "format": "date",
            "title": "Webhook",
            "description": "URI of the webhook to respond to"
        }
    }
}